{"task_id":"cccccccc-cccc-4ccc-8ccc-cccccccccccc","owner_user_id":"22222222-2222-4222-8222-222222222222","character_id":"miku","schedule":"0 9 * * *","timezone":"Asia/Seoul","action":{"tool":"project.status"},"permission":"read-only","delivery":{"channel":"push","include_full_result":false},"memory_policy":"result_only","status":"active","created_at":"2026-09-02T00:00:00Z","updated_at":"2026-09-02T00:00:00Z","expires_at":null}
